{"type":"config","name":"Effect v4 + floai harness migration","metricName":"failing_checks","metricUnit":"","bestDirection":"lower"}
{"run":1,"commit":"e14754d","metric":4,"metrics":{"passed_checks":5},"status":"keep","description":"baseline with autoresearch harness and P0 docs/editor groundwork","timestamp":1779556286596,"segment":0,"confidence":null,"iterationTokens":98,"asi":{"hypothesis":"Establish real-check migration metric before making Effect v4 harness changes.","baseline_failures":"4 failing gates: validate script missing, Effect v4 deps not migrated, old repos/effect present, repos/effect-smol missing.","next_action_hint":"Port low-risk reference/harness pieces first: replace old Effect subtree with effect-smol, add validate script, then migrate deps/tests."}}
{"run":2,"commit":"e14754d","metric":3,"metrics":{"passed_checks":6},"status":"keep","description":"replace old Effect subtree with effect-smol reference and add vendor refresh scripts","timestamp":1779556373405,"segment":0,"confidence":null,"iterationTokens":2977,"asi":{"hypothesis":"Removing old repos/effect and adding repos/effect-smol should satisfy the vendored-reference gate without touching application code.","result":"effect-smol-reference gate now passes; remaining failures are validate script missing and Effect v4 deps.","next_action_hint":"Add a real validate script/runner next to reduce missing-validate gate, then migrate dependencies/tests."}}
{"run":3,"commit":"dde9503","metric":2,"metrics":{"passed_checks":7},"status":"keep","description":"add effect-smol reference and initial validate gate","timestamp":1779556704876,"segment":0,"confidence":2,"iterationTokens":1975,"asi":{"hypothesis":"A current-check validate script plus vendored-reference replacement should reduce migration gates while preserving existing check behavior.","result":"validate now runs current check suite; effect-smol-reference passes; remaining metric failures are knip debt and Effect v4 dependency migration.","commit_issue_resolution":"Previous keep commit was blocked by lefthook touching vendored/log files; added repos/** lefthook excludes and ignored autoresearch logs so hooks can run cleanly.","next_action_hint":"Migrate dependency/test harness to Effect v4 and tune strict dependency checks (knip/fallow) without weakening real validation."}}
{"run":4,"commit":"dde9503","metric":5,"metrics":{"passed_checks":4},"status":"discard","description":"discard broad Effect v4 API/dependency migration despite typecheck success due regressed gates","timestamp":1779558319687,"segment":0,"confidence":2,"iterationTokens":1975,"asi":{"hypothesis":"Migrating dependencies and Effect v4 APIs broadly would clear the dependency gate while preserving or improving validation failures.","result":"typecheck and effect-v4-deps passed, but lint, format, test, knip, and validate failed; failing_checks regressed from 2 to 5.","rollback_reason":"Primary metric worsened; migration changed too much at once and introduced formatting/lint/test harness failures.","next_action_hint":"Reapply Effect v4 dependency/test harness migration in smaller slices: first migrate root/package deps with Vitest config and update test imports to avoid bun: loader/FastCheck failures, then format/lint before measuring.","failed_gates":["lint","format","test","knip","validate"],"passing_gates":["typecheck","effect-v4-deps","effect-smol-reference","no-warden"]}}
{"run":5,"commit":"1016a7f","metric":1,"metrics":{"passed_checks":8},"status":"keep","description":"clean up knip findings while preserving validation","timestamp":1779558767727,"segment":0,"confidence":3,"iterationTokens":69060,"asi":{"hypothesis":"Resolving actual unused files/exports and documenting external flyctl usage will make the strict knip gate pass without weakening validation.","result":"knip now passes; typecheck, lint, format, test, validate, vendored reference, and no-warden gates pass. Only effect-v4-deps remains.","changes":"Removed dead to-web-handler and useUserId files, dropped unused public exports, documented seed SQL export as package script, and ignored the external flyctl binary used by deploy.","next_action_hint":"Migrate Effect dependencies to v4 in a small, formatted slice; use the previous discarded attempt as a map but keep Bun tests stable until API changes compile and pass."}}
{"run":6,"commit":"5dc1041","metric":0,"metrics":{"passed_checks":9},"status":"keep","description":"migrate app and test harness to Effect v4 beta","timestamp":1779560524884,"segment":0,"confidence":3,"iterationTokens":58444,"asi":{"hypothesis":"Completing the Effect v4 dependency/API migration plus Vitest harness updates should clear the final dependency gate while keeping all real validation checks green.","result":"./autoresearch.sh passed all nine gates with failing_checks=0: typecheck, lint, format, test, knip, validate, effect-v4-deps, effect-smol-reference, and no-warden.","changes":"Moved runtime packages to Effect v4 beta imports/APIs, swapped tests to @effect/vitest under Bun-powered Vitest, updated Atom RPC/reactivity usage, adjusted Schema/DateTime/Context/Cache APIs, and added coverage provider dependency for knip.","validation":"run_experiment ./autoresearch.sh parsed METRIC failing_checks=0 and passed_checks=9.","next_action_hint":"Target reached. If continuing harness work, add remaining floai non-Warden pieces only if they preserve bun run validate and do not broaden scope."}}
{"run":7,"commit":"5dc1041","metric":0,"metrics":{"passed_checks":9},"status":"discard","description":"confirm zero failing checks without further code changes","timestamp":1779560631406,"segment":0,"confidence":3,"iterationTokens":58444,"asi":{"hypothesis":"Re-running the real gate after resuming should confirm the Effect v4 migration remains at the target metric without changing checks.","result":"./autoresearch.sh again reported failing_checks=0 and passed_checks=9.","rollback_reason":"No new code change and no primary metric improvement beyond the existing zero-failure target; per autoresearch rules unchanged primary metric is discard.","next_action_hint":"Do not chase benchmark-only changes. If broader floai harness work is desired after metric zero, reset/start a new experiment target with explicit additional gates rather than weakening or overfitting this one."}}
